question_id,question_content,A,B,C,D,true_answer,detail_explain,expert_common
99,A company hosts data in S3. There is now a mandate that going forward all data in the S3 bucket needs to encrypt at rest. How can this be achieved? Please select:,(A) Use AWS Access keys to encrypt the data,(B) Use SSL certificates to encrypt the data,(C) Enable server side encryption on the S3 bucket,(D) Enable MFA on the S3 bucket,C,"The AWS Documentation mentions the followingServer-side encryption is about data encryption at rest-that is, Amazon S3 encrypts your data at theobject level as it writes it to disks in its data centers and decrypts it for you when you access it. Aslong as you authenticate your request and you have access permissions, there is no difference in theway you access encrypted or unencrypted objects.Options A and B are invalid because neither Access Keys nor SSL certificates can be used to encryptdata.Option D is invalid because MFA is just used as an extra level of security for S3 buckets For moreinformation on S3 server side encryption, please refer to the below Link:https://docs.aws.amazon.com/AmazonS3/latest/dev/serv-side-encryption.html Submit yourFeedback/Queries to our Experts",
100,"A Systems Administrator has written the following Amazon S3 bucket policy designed to allow access to an S3 bucket for only an authorized AWS IAM user from the IP address range10.10.10.0/24. When trying to download an object from the S3 bucket from 10.10.10.40, the IAM user receives an access denied message. What does the Administrator need to change to grant access to the user?","(A) Change the ""Resource"" from ""arn: aws:s3:::Bucket"" to ""arn:aws:s3:::Bucket/*"".","(B) Change the ""Principal"" from ""*"" to {AWS:""arn:aws:iam: : account-number: user/username""}","(C) Change the ""Version"" from ""2012-10-17"" to the last revised date of the policy","(D) Change the ""Action"" from [""s3:*""] to [""s3:GetObject"", ""s3:ListBucket""]",A,,
101,Your company is planning on AWS on hosting its AWS resources. There is a company policy which mandates that all security keys are completely managed within the company itself. Which of the following is the correct measure of following this policy? Please select:,(A) Using the AWS KMS service for creation of the keys and the company managing the key lifecycle there after.,(B) Generating the key pairs for the EC2 Instances using puttygen,(C) Use the EC2 Key pairs that come with AWS,(D) Use S3 server-side encryption,B,"y ensuring that you generate the key pairs for EC2 Instances, you will have complete control of theaccess keys.Options A,C and D are invalid because all of these processes means that AWS has ownership of thekeys. And the question specifically mentions that you need ownership of the keys For information onsecurity for Compute Resources, please visit the below URL:https://d1.awsstatic.com/whitepapers/Security/Security Compute Services Whitepaper.pdfl Thecorrect answer is: Generating the key pairs for the EC2 Instances using puttygen Submit yourFeedback/Queries to our Experts",
104,Your company has a requirement to work with a DynamoDB table. There is a security mandate that all data should be encrypted at rest. What is the easiest way to accomplish this for DynamoDB. Please select:,(A) Use the AWS SDK to encrypt the data before sending it to the DynamoDB table,(B) Encrypt the DynamoDB table using KMS during its creation,(C) Encrypt the table using AWS KMS after it is created,(D) Use S3 buckets to encrypt the data before sending it to DynamoDB,B,"The most easiest option is to enable encryption when the DynamoDB table is created.The AWS Documentation mentions the following57Amazon DynamoDB offers fully managed encryption at rest. DynamoDB encryption at rest providesenhanced security by encrypting your data at rest using an AWS Key Management Service (AWS KMS)managed encryption key for DynamoDB. This functionality eliminates the operational burden andcomplexity involved in protecting sensitive data.Option A is partially correct, you can use the AWS SDK to encrypt the data, but the easier optionwould be to encrypt the table before hand.Option C is invalid because you cannot encrypt the table after it is created Option D is invalid becauseencryption for S3 buckets is for the objects in S3 only.For more information on securing data at rest for DynamoDB please refer to below URL:https://docs.aws.amazon.com/amazondynamodb/latest/developerguide/EncryptionAtRest.htmll Thecorrect answer is: Encrypt the DynamoDB table using KMS during its creation Submit yourFeedback/Queries to our Experts",
105,An organization receives an alert that indicates that an EC2 instance behind an ELB ClassicLoad Balancer has been compromised.What techniques will limit lateral movement and allow evidence gathering?,(A) Remove the instance from the load balancer and terminate it.,"(B) Remove the instance from the load balancer, and shut down access to the instance by tighteningthe security group.",(C) Reboot the instance and check for any Amazon CloudWatch alarms.,(D) Stop the instance and make a snapshot of the root EBS volume.,B,https://d1.awsstatic.com/whitepapers/aws_security_incident_response.pdf,
106,A company uses user data scripts that contain sensitive information to bootstrap AmazonEC2 instances. A Security Engineer discovers that this sensitive information is viewable by people whoshould not have access to it.What is the MOST secure way to protect the sensitive information used to bootstrap the instances?,(A) Store the scripts in the AMI and encrypt the sensitive data using AWS KMS Use the instance roleprofile to control access to the KMS keys needed to decrypt the data.,(B) Store the sensitive data in AWS Systems Manager Parameter Store using the encrypted stringparameter and assign the GetParameters permission to the EC2 instance role.,(C) Externalize the bootstrap scripts in Amazon S3 and encrypt them using AWS KMS. Remove thescripts from the instance and clear the logs after the instance is configured.,(D) Block user access of the EC2 instance's metadata service using IAM policies. Remove all scripts andclear the logs after execution.,A,,
108,Your company is planning on hosting an internal network in AWS. They want machines inthe VPC to authenticate using private certificates. They want to minimize the work and maintenancein working with certificates. What is the ideal way to fulfil this requirement.Please select:,(A) Consider using Windows Server 2016 Certificate Manager,(B) Consider using AWS Certificate Manager,(C) Consider using AWS Access keys to generate the certificates,(D) Consider using AWS Trusted Advisor for managing the certificates,B,"The AWS Documentation mentions the followingACM is tightly linked with AWS Certificate Manager Private Certificate Authority. You can use ACMPCA to create a private certificate authority (CA) and then use ACM to issue private certificates. Theseare SSL/TLSX.509 certificates that identify users, computers, applications, services, servers, and other devicesinternally.Private certificates cannot be publicly trustedOption A is partially invalid. Windows Server 2016 Certificate Manager can be used but since there isa requirement to ""minimize the work and maintenance"", AWS Certificate Manager should be usedOption C and D are invalid because these cannot be used for managing certificates.For more information on ACM, please visit the below URL:https://docs.aws.amazon.com/acm/latest/userguide/acm-overview.htmlThe correct answer is: Consider using AWS Certificate Manager Submit your Feedback/Queries to ourExperts",
110,A user has created a VPC with the public and private subnets using the VPC wizard. The VPChas CIDR20.0.0.0/16. The public subnet uses CIDR 20.0.1.0/24. The user is planning to host a web server in thepublic subnet with port 80 and a Database server in the private subnet with port 3306. The user isconfiguring a security group for the public subnet (WebSecGrp) and the private subnet (DBSecGrp).which of the below mentioned entries is required in the private subnet database security groupDBSecGrp?Please select:,(A) Allow Inbound on port 3306 for Source Web Server Security Group WebSecGrp.,(B) Allow Inbound on port 3306 from source 20.0.0.0/16,(C) Allow Outbound on port 3306 for Destination Web Server Security Group WebSecGrp.60,(D) Allow Outbound on port 80 for Destination NAT Instance IP,A,Since the Web server needs to talk to the database server on port 3306 that means that the databaseserver should allow incoming traffic on port 3306. The below table from the aws documentationshows how the security groups should be set up.Option B is invalid because you need to allow incoming access for the database server from theWebSecGrp security group.Options C and D are invalid because you need to allow Outbound traffic and not inbound traffic Formore information on security groups please visit the below Link:http://docs.aws.amazon.com/AmazonVPC/latest/UserGuide/VPCScenario2.htmlThe correct answer is: Allow Inbound on port 3306 for Source Web Server Security GroupWebSecGrp.Submit your Feedback/Queries to our Experts,
111,Which of the following minimizes the potential attack surface for applications?,(A) Use security groups to provide stateful firewalls for Amazon EC2 instances at the hypervisor level.,(B) Use network ACLs to provide stateful firewalls at the VPC level to prevent access to any specificAWS resource.,(C) Use AWS Direct Connect for secure trusted connections between EC2 instances within privatesubnets.,"(D) Design network security in a single layer within the perimeter network (also known as DMZ,demilitarized zone, and screened subnet) to facilitate quicker responses to threats.",A,https://aws.amazon.com/answers/networking/vpc-security-capabilities/ Security Group is statefuland hypervisor level.,
112,"A company's database developer has just migrated an Amazon RDS database credential tobe stored and managed by AWS Secrets Manager. The developer has also enabled rotation of thecredential within the Secrets Manager console and set the rotation to change every 30 days.After a short period of time, a number of existing applications have failed with authentication errors.61What is the MOST likely cause of the authentication errors?",(A) Migrating the credential to RDS requires that all access come through requests to the SecretsManager.,"(B) Enabling rotation in Secrets Manager causes the secret to rotate immediately, and the applicationsare using the earlier credential.",(C) The Secrets Manager IAM policy does not allow access to the RDS database.,(D) The Secrets Manager IAM policy does not allow access for the applications.,B,https://docs.aws.amazon.com/secretsmanager/latest/userguide/enable-rotation-rds.html,
113,You are trying to use the AWS Systems Manager run command on a set of Instances. Therun command on a set of Instances. What can you do to diagnose the issue? Choose 2 answers fromthe options given Please select:,(A) Ensure that the SSM agent is running on the target machine,(B) Check the /var/log/amazon/ssm/errors.log file,(C) Ensure the right AMI is used for the Instance,(D) Ensure the security groups allow outbound communication for the instance,A B,"The AWS Documentation mentions the followingIf you experience problems executing commands using Run Command, there might be a problemwith the SSM Agent. Use the following information to help you troubleshoot the agent View AgentLogs The SSM Agent logs information in the following files. The information in these files can help youtroubleshoot problems.On Windows%PROGRAMDATA%\Amazon\SSM\Logs\amazon-ssm-agent.log%PROGRAMDATA%\Amazon\SSM\Logs\error.logThe default filename of the seelog is seelog-xml.template. If you modify a seelog, you must renamethe file to seelog.xml.On Linux/var/log/amazon/ssm/amazon-ssm-agentlog /var/log/amazon/ssm/errors.logOption C is invalid because the right AMI has nothing to do with the issues. The agent which is usedto execute run commands can run on a variety of AMI'S Option D is invalid because security groupsdoes not come into the picture with the communication between the agent and the SSM service Formore information on troubleshooting AWS SSM, please visit the following URL:https://docs.aws.amazon.com/systems-manaeer/latest/userguide/troubleshootine-remote-commands.htmll The correct answers are: Ensure that the SSM agent is running on the targetmachine. Check the/var/log/amazon/ssm/errors.log fileSubmit your Feedback/Queries to our Experts",
114,You have an S3 bucket hosted in AWS. This is used to host promotional videos uploaded byyourself. You need to provide access to users for a limited duration of time. How can this beachieved?62Please select:,(A) Use versioning and enable a timestamp for each version,(B) Use Pre-signed URL's,(C) Use 1AM Roles with a timestamp to limit the access,(D) Use 1AM policies with a timestamp to limit the access,B,"The AWS Documentation mentions the followingAll objects by default are private. Only the object owner has permission to access these objects.However, the object owner can optionally share objects with others by creating a pre-signed URLusing their own security credentials, to grant time-limited permission to download the objects.Option A is invalid because this can be used to prevent accidental deletion of objects Option C isinvalid because timestamps are not possible for Roles Option D is invalid because policies is not theright way to limit access based on time For more information on pre-signed URL's, please visit theURL:https://docs.aws.ama2on.com/AmazonS3/latest/dev/ShareObiectPreSisnedURL.html The correctanswer is: Use Pre-signed URL's Submit your Feedback/Queries to our Experts",
115,A Security Engineer must add additional protection to a legacy web application by addingthe following HTTP security headers:-Content Security-Policy-X-Frame-Options-X-XSS-ProtectionThe Engineer does not have access to the source code of the legacy web application.Which of the following approaches would meet this requirement?,(A) Configure an Amazon Route 53 routing policy to send all web traffic that does not include therequired headers to a black hole.,(B) Implement an AWS Lambda@Edge origin response function that inserts the required headers.,(C) Migrate the legacy application to an Amazon S3 static website and front it with an AmazonCloudFront distribution.,(D) Construct an AWS WAF rule to replace existing HTTP headers with the required security headersby using regular expressions.,B,,
116,A web application runs in a VPC on EC2 instances behind an ELB Application Load Balancer.The application stores data in an RDS MySQL DB instance. A Linux bastion host is used to applyschema updates to the database - administrators connect to the host via SSH from a corporateworkstation. The following security groups are applied to the infrastructure-* sgLB - associated with the ELB* sgWeb - associated with the EC2 instances.* sgDB - associated with the database* sgBastion - associated with the bastion host Which security group configuration will allow theapplication to be secure and functional?Please select:,(A) sgLB :allow port 80 and 443 traffic from 0.0.0.0/063sgWeb :allow port 80 and 443 traffic from 0.0.0.0/0sgDB :allow port 3306 traffic from sgWeb and sgBastionsgBastion: allow port 22 traffic from the corporate IP address range,(B) sgLB :aIlow port 80 and 443 traffic from 0.0.0.0/0sgWeb :allow port 80 and 443 traffic from sgLBsgDB :allow port 3306 traffic from sgWeb and sgLBsgBastion: allow port 22 traffic from the VPC IP address range,(C) sgLB :allow port 80 and 443 traffic from 0.0.0.0/0sgWeb :allow port 80 and 443 traffic from sgLBsgDB :allow port 3306 traffic from sgWeb and sgBastionsgBastion: allow port 22 traffic from the VPC IP address range,(D) sgLB :allow port 80 and 443 traffic from 0.0.0.0/0sgWeb :allow port 80 and 443 traffic from sgLBsgDB :al!ow port 3306 traffic from sgWeb and sgBastionsgBastion: allow port 22 traffic from the corporate IP address range,D,"The Load Balancer should accept traffic on ow port 80 and 443 traffic from 0.0.0.0/0 The backend EC2Instances should accept traffic from the Load Balancer The database should allow traffic from theWeb server And the Bastion host should only allow traffic from a specific corporate IP address rangeOption A is incorrect because the Web group should only allow traffic from the Load balancer Formore information on AWS Security Groups, please refer to below URL:https://docs.aws.amazon.com/AWSEC2/latest/UserGuide/usins-network-security.htmll The correctanswer is: sgLB :allow port 80 and 443 traffic from 0.0.0.0/0 sgWeb :allow port 80 and 443 trafficfrom sgLB sgDB :allow port 3306 traffic from sgWeb and sgBastion sgBastion: allow port 22 trafficfrom the corporate IP address range Submit your Feedback/Queries to our Experts",
117,"An organization has three applications running on AWS, each accessing the same data onAmazon S3. The data on Amazon S3 is server-side encrypted by using an AWS KMS Customer MasterKey (CMK).What is the recommended method to ensure that each application has its own programmatic accesscontrol permissions on the KMS CMK?",(A) Change the key policy permissions associated with the KMS CMK for each application when it mustaccess the data in Amazon S3.,(B) Have each application assume an IAM role that provides permissions to use the AWS CertificateManager CMK.,(C) Have each application use a grant on the KMS CMK to add or remove specific access controls onthe KMS CMK.,(D) Have each application use an IAM policy in a user context to have specific access permissions onthe KMS CMK.,C,,
118,"A Security Engineer is setting up an AWS CloudTrail trail for all regions in an AWS account.For added security, the logs are stored using server-side encryption with AWS KMS-managed keys(SSE-KMS) and have log integrity validation enabled.64While testing the solution, the Security Engineer discovers that the digest files are readable, but thelog files are not. What is the MOST likely cause?",(A) The log files fail integrity validation and automatically are marked as unavailable.,(B) The KMS key policy does not grant the Security Engineer's IAM user or role permissions to decryptwith it.,(C) The bucket is set up to use server-side encryption with Amazon S3-managed keys (SSE-S3) as thedefault and does not allow SSE-KMS-encrypted files.,"(D) An IAM policy applicable to the Security Engineer's IAM user or role denies access to the""CloudTrail/"" prefix in the Amazon S3 bucket",B,,
119,A company is developing a highly resilient application to be hosted on multiple Amazon EC2instances . The application will store highly sensitive user data in Amazon RDS tables The applicationmust* Include migration to a different AWS Region in the application disaster recovery plan.* Provide a full audit trail of encryption key administration events* Allow only company administrators to administer keys.* Protect data at rest using application layer encryptionA Security Engineer is evaluating options for encryption key management Why should the SecurityEngineer choose AWS CloudHSM over AWS KMS for encryption key management in this situation?,(A) The key administration event logging generated by CloudHSM is significantly more extensive thanAWS KMS.,"(B) CloudHSM ensures that only company support staff can administer encryption keys, whereas AWSKMS allows AWS staff to administer keys",(C) The ciphertext produced by CloudHSM provides more robust protection against brute forcedecryption attacks than the ciphertext produced by AWS KMS,"(D) CloudHSM provides the ability to copy keys to a different Region, whereas AWS KMS does not",B,,
120,You are creating a Lambda function which will be triggered by a Cloudwatch Event. The datafrom these events needs to be stored in a DynamoDB table. How should the Lambda function begiven access to the DynamoDB table?Please select:,(A) Put the AWS Access keys in the Lambda function since the Lambda function by default is secure,(B) Use an 1AM role which has permissions to the DynamoDB table and attach it to the Lambdafunction.,(C) Use the AWS Access keys which has access to DynamoDB and then place it in an S3 bucket.,(D) Create a VPC endpoint for the DynamoDB table. Access the VPC endpoint from the Lambdafunction.,B,"AWS Lambda functions uses roles to interact with other AWS services. So use an 1AM role which haspermissions to the DynamoDB table and attach it to the Lambda function.Options A and C are all invalid because you should never use AWS keys for access.65Option D is invalid because the VPC endpoint is used for VPCsFor more information on Lambda function Permission model, please visit the URLhttps://docs.aws.amazon.com/lambda/latest/dg/intro-permission-model.html The correct answer is:Use an 1AM role which has permissions to the DynamoDB table and attach it to the Lambda function.Submit your Feedback/Queries to our Experts",
121,"You are deivising a policy to allow users to have the ability to access objects in a bucketcalled appbucket.You define the below custom bucket policy But when you try to apply the policy you get the error ""Action does not apply to any resource(s) instatement."" What should be done to rectify the error Please select:",(A) Change the 1AM permissions by applying PutBucketPolicy permissions.,(B) Verify that the policy has the same name as the bucket name. If not. make it the same.,"(C) Change the Resource section to ""arn:aws:s3:::appbucket/*'.","(D) Create the bucket ""appbucket"" and then apply the policy.",C,"When you define access to objects in a bucket you need to ensure that you specify to which objectsin the bucket access needs to be given to. In this case, the * can be used to assign the permission toall objects in the bucket Option A is invalid because the right permissions are already provided as perthe question requirement Option B is invalid because it is not necessary that the policy has the samename as the bucket Option D is invalid because this should be the default flow for applying the policy66For more information on bucket policies please visit the below URL:https://docs.aws.amazon.com/AmazonS3/latest/dev/example-bucket-policies.htmll The correctanswer is: Change the Resource section to ""arn:aws:s3:::appbucket/"" Submit your Feedback/Queriesto our Experts",
122,A security team is creating a response plan in the event an employee executes unauthorizedactions on AWS infrastructure. They want to include steps to determine if the employee's 1AMpermissions changed as part of the incident.What steps should the team document in the plan?Please select:,(A) Use AWS Config to examine the employee's 1AM permissions prior to the incident and comparethem to the employee's current 1AM permissions.,(B) Use Made to examine the employee's 1AM permissions prior to the incident and compare them tothe employee's A current 1AM permissions.,(C) Use CloudTrail to examine the employee's 1AM permissions prior to the incident and comparethem to the employee's current 1AM permissions.,(D) Use Trusted Advisor to examine the employee's 1AM permissions prior to the incident andcompare them to the employee's current 1AM permissions.,A,"You can use the AWSConfig history to see the history of a particular item.The below snapshot shows an example configuration for a user in AWS ConfigOption B,C and D are all invalid because these services cannot be used to see the history of aparticular configuration item. This can only be accomplished by AWS Config.For more information on tracking changes in AWS Config, please visit the below URL:https://docs.aws.amazon.com/AmazonCloudFront/latest/DeveloperGuide/TrackineChanees.htmllThe correct answer is: Use AWS Config to examine the employee's 1AM permissions prior to theincident and compare them the employee's current 1AM permissions.Submit your Feedback/Queries to our Experts",
123,There is a set of Ec2 Instances in a private subnet. The application hosted on these EC2Instances need to access a DynamoDB table. It needs to be ensured that traffic does not flow out tothe internet. How can this be achieved?Please select:,(A) Use a VPC endpoint to the DynamoDB table,(B) Use a VPN connection from the VPC67,(C) Use a VPC gateway from the VPC,(D) Use a VPC Peering connection to the DynamoDB table,A,"The following diagram from the AWS Documentation shows how you can access the DynamoDBservice from within a V without going to the Internet This can be done with the help of a VPCendpointOption B is invalid because this is used for connection between an on-premise solution and AWSOption C is invalid because there is no such option Option D is invalid because this is used to connect2 VPCs For more information on VPC endpointsfor DynamoDB, please visit the URL:The correct answer is: Use a VPC endpoint to the DynamoDB table Submit your Feedback/Queries toour Experts",
