question_id,question_content,A,B,C,D,true_answer,detail_explain,expert_common
30,Your company has an EC2 Instance hosted in AWS. This EC2 Instance hosts an application. Currently this application is experiencing a number of issues. You need to inspect the network packets to see what the type of error that is occurring? Which one of the below steps can help address this issue? Please select:,(A) Use the VPC Flow Logs.,(B) Use a network monitoring tool provided by an AWS partner.,"(C) Use another instance. Setup a port to ""promiscuous mode"" and sniff the traffic to analyze thepackets. -",(D) Use Cloudwatch metric,B,,
31,You want to get a list of vulnerabilities for an EC2 Instance as per the guidelines set by the 15 Center of Internet Security.  How can you go about doing this? Please select:,(A) Enable AWS Guard Duty for the Instance,(B) Use AWS Trusted Advisor,(C) Use AWS inspector,(D) UseAWSMacie,C,"The AWS Inspector service can inspect EC2 Instances based on specific Rules. One of the rulespackages is based on the guidelines set by the Center of Internet Security Center for Internet security(CIS) Benchmarks The CIS Security Benchmarks program provides well-defined, un-biased andconsensus-based industry best practices to help organizations assess and improve their security.Amazon Web Services is a CIS Security Benchmarks Member company and the list of AmazonInspector certifications can be viewed nere.Option A is invalid because this can be used to protect an instance but not give the list ofvulnerabilities Options B and D are invalid because these services cannot give a list of vulnerabilitiesFor more information on the guidelines, please visit the below URL:* https://docs.aws.amazon.com/inspector/latest/userguide/inspector_cis.html The correct answer is:Use AWS Inspector Submit your Feedback/Queries to our Experts",
32,"A company recently experienced a DDoS attack that prevented its web server from serving content. The website is static and hosts only HTML, CSS, and PDF files that users download. Based on the architecture shown in the image, what is the BEST way to protect the site against future attacks while minimizing the ongoing operational overhead?",(A) Move all the files to an Amazon S3 bucket. Have the web server serve the files from the S3 bucket.,(B) Launch a second Amazon EC2 instance in a new subnet. Launch an Application Load Balancer infront of both instances.,(C) Launch an Application Load Balancer in front of the EC2 instance. Create an Amazon CloudFrontdistribution in front of the Application Load Balancer.,(D) Move all the files to an Amazon S3 bucket. Create a CloudFront distribution in front of the bucketand terminate the web server.,D,https://docs.aws.amazon.com/AmazonS3/latest/dev/WebsiteHosting.html,
35,An organization has launched 5 instances: 2 for production and 3 for testing. The organization wants that one particular group of IAM users should only access the test instances and not the production ones. How can the organization set that as a part of the policy? Please select:,(A) Launch the test and production instances in separate regions and allow region wise access to the group,(B) Define the IAM policy which allows access based on the instance ID,(C) Create an IAM policy with a condition which allows access to only small instances,(D) Define the tags on the test and production servers and add a condition to the IAM policy which allows access to specification tags,D,"Tags enable you to categorize your AWS resources in different ways, for example, by purpose, owner,or environment. This is useful when you have many resources of the same type - you can quicklyidentify a specific resource based on the tags you've assigned to it Option A is invalid because this is18not a recommended practices Option B is invalid because this is an overhead to maintain this inpolicies Option C is invalid because the instance type will not resolve the requirement Forinformation on resource tagging, please visit the below URL:http://docs.aws.amazon.com/AWSEC2/latest/UserGuide/Usine_Tags.htmllThe correct answer is: Define the tags on the test and production servers and add a condition to the1AM policy which allows access to specific tags Submit your Feedback/Queries to our Experts",
36,"A Solutions Architect is designing a web application that uses Amazon CloudFront, an ElasticLoad Balancing Application Load Balancer, and an Auto Scaling group of Amazon EC2 instances. The load balancer and EC2 instances are in the US West (Oregon) region. It has been decided that encryption in transit is necessary by using a customer-branded domain name from the client to CloudFront and from CloudFront to the load balancer. Assuming that AWS Certificate Manager is used, how many certificates will need to be generated?",(A) One in the US West (Oregon) region and one in the US East (Virginia) region.,(B) Two in the US West (Oregon) region and none in the US East (Virginia) region.,(C) One in the US West (Oregon) region and none in the US East (Virginia) region.,(D) Two in the US East (Virginia) region and none in the US West (Oregon) region.,A,"AWS Region that You Request a Certificate In (for AWS Certificate Manager) If you want to requireHTTPS between viewers and CloudFront, you must change the AWS region to US East (N. Virginia) inthe AWS Certificate Manager console before you request or import a certificate. If you want torequire HTTPS between CloudFront and your origin, and you're using an ELB load balancer as yourorigin, you can request or import a certificate in any region.https://docs.aws.amazon.com/AmazonCloudFront/latest/DeveloperGuide/cnames-and-https-requirements.html",
38,A company has a set of EC2 Instances hosted in AWS. The EC2 Instances have EBS volumes which is used to store critical information. There is a business continuity requirement to ensure high availability for the EBS volumes. How can you achieve this?,(A) Use lifecycle policies for the EBS volumes,(B) Use EBS Snapshots,(C) Use EBS volume replication,(D) Use EBS volume encryption,B,"Data stored in Amazon EBS volumes is redundantly stored in multiple physical locations as part ofnormal operation of those services and at no additional charge. However, Amazon EBS replication isstored within the same availability zone, not across multiple zones; therefore, it is highlyrecommended that you conduct regular snapshots to Amazon S3 for long-term data durability OptionA is invalid because there is no lifecycle policy for EBS volumes Option C is invalid because there is noEBS volume replication Option D is invalid because EBS volume encryption will not ensure businesscontinuity For information on security for Compute Resources, please visit the below URL:https://d1.awsstatic.com/whitepapers/Security/Security_Compute_Services_Whitepaper.pdf",
39,A company is planning to run a number of Admin related scripts using the AWS Lambda service. There is a need to understand if there are any errors encountered when the script run. How can this be accomplished in the most effective manner. Please select:,(A) Use Cloudwatch metrics and logs to watch for errors,(B) Use Cloudtrail to monitor for errors,(C) Use the AWS Config service to monitor for errors,(D) Use the AWS inspector service to monitor for errors,A,"The AWS Documentation mentions the followingAWS Lambda automatically monitors Lambda functions on your behalf, reporting metrics throughAmazon CloudWatch. To help you troubleshoot failures in a function. Lambda logs all requestshandled by your function and also automatically stores logs generated by your code through AmazonCloudWatch Logs.Option B,C and D are all invalid because these services cannot be used to monitor for errors. I Formore information on Monitoring Lambda functions, please visit the following URL:https://docs.aws.amazon.com/lambda/latest/dg/monitorine-functions-loes.htmll The correct answeris: Use Cloudwatch metrics and logs to watch for errors Submit your Feedback/Queries to our Experts",
40,"You have private video content in S3 that you want to serve to subscribed users on the Internet. User IDs, credentials, and subscriptions are stored in an Amazon RDS database. Which configuration will allow you to securely serve private content to your users? Please select:",(A) Generate pre-signed URLs for each user as they request access to protected S3 content,(B) Create an 1AM user for each subscribed user and assign the GetObject permission to each 1AMuser,(C) Create an S3 bucket policy that limits access to your private content to only your subscribedusers'credentials20,(D) Crpafp a Cloud Front Clriein Identity user for vnur suhsrrihprl users and assign the GptOhiprtoprmissinn to this user,A,"All objects and buckets by default are private. The pre-signed URLs are useful if you want youruser/customer to be able upload a specific object to your bucket but you don't require them to haveAWS security credentials or permissions. When you create a pre-signed URL, you must provide yoursecurity credentials, specify a bucket name, an object key, an HTTP method (PUT for uploadingobjects), and an expiration date and time.The pre-signed URLs are valid only for the specified duration.Option B is invalid because this would be too difficult to implement at a user level.Option C is invalid because this is not possibleOption D is invalid because this is used to serve private content via Cloudfront For more informationon pre-signed urls, please refer to the Link:http://docs.aws.amazon.com/AmazonS3/latest/dev/PresienedUrlUploadObiect.htmll The correctanswer is: Generate pre-signed URLs for each user as they request access to protected S3 contentSubmit your Feedback/Queries to our Experts",
41,You have an instance setup in a test environment in AWS. You installed the required application and the promoted the server to a production environment. Your IT Security team has advised that there maybe traffic flowing in from an unknown IP address to port 22. How can this be mitigated immediately? Please select:,(A) Shutdown the instance,(B) Remove the rule for incoming traffic on port 22 for the Security Group,(C) Change the AMI for the instance,(D) Change the Instance type for the instance,B,"In the test environment the security groups might have been opened to all IP addresses for testingpurpose.Always to ensure to remove this rule once all testing is completed.Option A, C and D are all invalid because this would affect the application running on the server. Theeasiest way is just to remove the rule for access on port 22.For more information on authorizing access to an instance, please visit the below URL:https://docs.aws.amazon.com/AWSEC2/latest/UserGuide/authorizing-access-to-an-instance.htmllThe correct answer is: Remove the rule for incoming traffic on port 22 for the Security Group Submityour Feedback/Queries to our Experts",
42,A company had one of its Amazon EC2 key pairs compromised. A Security Engineer must identify which current Linux EC2 instances were deployed and used the compromised key pair. How can this task be accomplished?,"(A) Obtain the list of instances by directly querying Amazon EC2 using: aws ec2 describe-instances --fi1ters""Name=key-name,Values=KEYNAMEHERE"".21","(B) Obtain the fingerprint for the key pair from the AWS Management Console, then search for the fingerprint in the Amazon Inspector logs.",(C) Obtain the output from the EC2 instance metadata using: curl http://169.254.169.254/latest/meta-data/public- keys/0/.,"(D) Obtain the fingerprint for the key pair from the AWS Management Console, then search for the fingerprint in Amazon CloudWatch Logs using: aws logs filter-log-events.",D,,
43,There is a requirement for a company to transfer large amounts of data between AWS and anon-premise location. There is an additional requirement for low latency and high consistency trafficto AWS. Given these requirements how would you design a hybrid architecture? Choose the correctanswer from the options below Please select:,(A) Provision a Direct Connect connection to an AWS region using a Direct Connect partner.,"(B) Create a VPN tunnel for private connectivity, which increases network consistency and reduceslatency.","(C) Create an iPSec tunnel for private connectivity, which increases network consistency and reduceslatency.",(D) Create a VPC peering connection between AWS and the Customer gateway.,A,"AWS Direct Connect makes it easy to establish a dedicated network connection from your premisesto AWS.Using AWS Direct Connect you can establish private connectivity between AWS and your datacenter,office, or colocation environment which in many cases can reduce your network costs, increasebandwidth throughput and provide a more consistent network experience than Internet-basedconnections.Options B and C are invalid because these options will not reduce network latency Options D isinvalid because this is only used to connect 2 VPC's For more information on AWS direct connect, justbrowse to the below URL:https://aws.amazon.com/directconnectThe correct answer is: Provision a Direct Connect connection to an AWS region using a Direct Connectpartner. omit your Feedback/Queries to our Experts",
44,Your company is planning on developing an application in AWS. This is a web based application. The application users will use their facebook or google identities for authentication. You want to have the ability to manage user profiles without having to add extra coding to manage this. Which of the below would assist in this. Please select:,(A) Create an OlDC identity provider in AWS,(B) Create a SAML provider in AWS,(C) Use AWS Cognito to manage the user profiles,(D) Use IAM users to manage the user profiles,C,"22The AWS Documentation mentions the followingOIDC identity providers are entities in 1AM that describe an identity provider (IdP) service thatsupports the OpenID Connect (OIDC) standard. You use an OIDC identity provider when you want toestablish trust between an OlDC-compatible IdP-such as Google, Salesforce, and many others-andyour AWS account This is useful if you are creating a mobile app or web application that requiresaccess to AWS resources, but you don't want to create custom sign-in code or manage your own useridentities Option A is invalid because in the security groups you would not mention this information/Option C is invalid because SAML is used for federated authentication Option D is invalid because youneed to use the OIDC identity provider in AWS For more information on ODIC identity providers,please refer to the below Link:https://docs.aws.amazon.com/IAM/latest/UserGuide/id roles providers create oidc.htmll The correctanswer is: Create an OIDC identity provider in AWS",
45,You need to create a policy and apply it for just an individual user. How could you accomplish this in the right way? Please select:,(A) Add an AWS managed policy for the user,(B) Add a service policy for the user,(C) Add an IAM role for the user,(D) Add an inline policy for the user,D,"Options A and B are incorrect since you need to add an inline policy just for the user Option C isinvalid because you don't assign an 1AM role to a user The AWS Documentation mentions thefollowing An inline policy is a policy that's embedded in a principal entity (a user, group, or role)-thatis, the policy is an inherent part of the principal entity. You can create a policy and embed it in aprincipal entity, either when you create the principal entity or later.For more information on 1AM Access and Inline policies, just browse to the below URL:https://docs.aws.amazon.com/IAM/latest/UserGuide/accessThe correct answer is: Add an inline policy for the user Submit your Feedback/Queries to our Experts",
48,A Security Analyst attempted to trouble shoot the monitoring of suspicious security group changes. The Analyst was told that there is an Amazon CloudWatch alarm in place for these AWS CloudTrail log events. The Analyst tested the monitoring setup by making a configuration change to the security group butdid not receive any alerts. Which of the following trouble shooting steps should the Analyst perform?,(A) Ensure that CloudTrail and S3 bucket access logging is enabled for the Analyst's AWS account.,(B) Verify that a metric filter was created and then mapped to an alarm. Check the alarm notification action.,(C) Check the CloudWatch dashboards to ensure that there is a metric configured with an a ppropriate dimension for security group changes.,(D) Verify that the Analyst's account is mapped to an IAM policy that includes permissions for cloudwatch:GetMetricStatistics and Cloudwatch: ListMetrics.,B,MetricFilter:Type: 'AWS::Logs::MetricFilter'Properties:LogGroupName: ''FilterPattern: >-{ (.eventName = AuthorizeSecurityGroupIngress) || (.eventName =AuthorizeSecurityGroupEgress) || (.eventName =RevokeSecurityGroupIngress) || (.eventName = RevokeSecurityGroupEgress)|| (.eventName = CreateSecurityGroup) || (.eventName =DeleteSecurityGroup) }MetricTransformations:- MetricValue: '1'MetricNamespace: CloudTrailMetricsMetricName: SecurityGroupEventCount,
49,A Security Engineer has been asked to create an automated process to disable IAM user access keys that are more than three months old. Which of the following options should the Security Engineer use?,"(A) In the AWS Console, choose the IAM service and select ""Users"". Review the ""Access Key Age""column.",(B) Define an IAM policy that denies access if the key age is more than three months and apply to allusers.,"(C) Write a script that uses the GenerateCredentialReport, GetCredentialReport, and UpdateAccessKey APIs.",(D) Create an Amazon CloudWatch alarm to detect aged access keys and use an AWS Lambda functionto disable the keys older than 90 days.,C,https://docs.aws.amazon.com/IAM/latest/APIReference/API_UpdateAccessKey.htmlhttps://docs.aws.amazon.com/IAM/latest/APIReference/API_GenerateCredentialReport.htmlhttps://docs.aws.amazon.com/IAM/latest/APIReference/API_GetCredentialReport.html,
51,The Security team believes that a former employee may have gained unauthorized access to AWS resources sometime in the past 3 months by using an identified access key. What approach would enable the Security team to find out what the former employee may have done within AWS?,(A) Use the AWS CloudTrail console to search for user activity.,(B) Use the Amazon CloudWatch Logs console to filter CloudTrail data by user.,(C) Use AWS Config to see what actions were taken by the user.,(D) Use Amazon Athena to query CloudTrail logs stored in Amazon S3.,A,You can use CloudTrail to search event history for the last 90 days. You can use CloudWatch queriesto search API history beyond the last 90 days. You can use Athena to query CloudTrail logs over thelast 90 days.https://aws.amazon.com/premiumsupport/knowledge-center/view-iam-history/,
52,A Software Engineer wrote a customized reporting service that will run on a fleet of AmazonEC2 instances. The company security policy states that application logs for the reporting service must be centrally collected. What is the MOST efficient way to meet these requirements?,(A) Write an AWS Lambda function that logs into the EC2 instance to pull the application logs from theEC2 instance and persists them into an Amazon S3 bucket.,"(B) Enable AWS CloudTrail logging for the AWS account, create a new Amazon S3 bucket, and then configure Amazon CloudWatch Logs to receive the application logs from CloudTrail.",(C) Create a simple cron job on the EC2 instances that synchronizes the application logs to an AmazonS3 bucket by using rsync.,"(D) Install the Amazon CloudWatch Logs Agent on the EC2 instances, and configure it to send the application logs to CloudWatch Logs.",D,https://aws.amazon.com/blogs/aws/cloudwatch-log-service/,
53,A Security Administrator is performing a log analysis as a result of a suspected AWS account compromise.The Administrator wants to analyze suspicious AWS CloudTrail log files but is overwhelmed by the volume of audit logs being generated. What approach enables the Administrator to search through the logs MOST efficiently?,"(A) Implement a ""write-only"" CloudTrail event filter to detect any modifications to the AWS account resources.",(B) Configure Amazon Macie to classify and discover sensitive data in the Amazon S3 bucket that contains the CloudTrail audit logs.,(C) Configure Amazon Athena to read from the CloudTrail S3 bucket and query the logs to examine account activities.,(D) Enable Amazon S3 event notifications to trigger an AWS Lambda function that sends an email alarm when there are new CloudTrail API entries.,C,,
55,"A water utility company uses a number of Amazon EC2 instances to manage updates to a fleet of 2,000 Internet of Things (IoT) field devices that monitor water quality. These devices each have unique access credentials. An operational safety policy requires that access to specific credentials is independently auditable. What is the MOST cost-effective way to manage the storage of credentials?",(A) Use AWS Systems Manager to store the credentials as Secure Strings Parameters. Secure by usingan AWS KMS key.,"(B) Use AWS Key Management System to store a master key, which is used to encrypt the credentials. The encrypted credentials are stored in an Amazon RDS instance.",(C) Use AWS Secrets Manager to store the credentials.,(D) Store the credentials in a JSON file on Amazon S3 with server-side encryption.,A,https://docs.aws.amazon.com/systems-manager/latest/userguide/parameter-store-advanced-parameters.html,
59,"The Information Technology department has stopped using Classic Load Balancers and switched to Application Load Balancers to save costs. After the switch, some users on older devices are no longer able to connect to the website. What is causing this situation?",(A) Application Load Balancers do not support older web browsers.,(B) The Perfect Forward Secrecy settings are not configured correctly.,(C) The intermediate certificate is installed within the Application Load Balancer.,(D) The cipher suites on the Application Load Balancers are blocking connections.,D,https://docs.aws.amazon.com/elasticloadbalancing/latest/application/create-https-listener.html,
60,Your CTO is very worried about the security of your AWS account. How best can you prevent hackers from completely hijacking your account? Please select:,(A) Use short but complex password on the root account and any administrators.,(B) Use AWS IAM Geo-Lock and disallow anyone from logging in except for in your city.,"(C) Use MFA on all users and accounts, especially on the root account.",(D) Don't write down or remember the root account password after creating the AWS account.,C,"Multi-factor authentication can add one more layer of security to your AWS account Even when you30go to your Security Credentials dashboard one of the items is to enable MFA on your root accountOption A is invalid because you need to have a good password policy Option B is invalid becausethere is no1AM Geo-Lock Option D is invalid because this is not a recommended practices For more informationon MFA, please visit the below URLhttp://docs.aws.amazon.com/IAM/latest/UserGuide/idcredentials mfa.htmllThe correct answer is: Use MFA on all users and accounts, especially on the root account.Submit your Feedback/Queries to our Experts",
61,"When you enable automatic key rotation for an existing CMK key where the backing key is managed by AWS, after how long is the key rotated? Please select:",(A) After 30 days,(B) After 128 days,(C) After 365 days,(D) After 3 years,D,"The AWS Documentation states the following* AWS managed CM Ks: You cannot manage key rotation for AWS managed CMKs. AWS KMSautomatically rotates AWS managed keys every three years (1095 days).Note: AWS-managed CMKs are rotated every 3yrs, Customer-Managed CMKs are rotated every 365-days from when rotation is enabled.Option A, B, C are invalid because the dettings for automatic key rotation is not changeable.For more information on key rotation please visit the below URLhttps://docs.aws.amazon.com/kms/latest/developereuide/rotate-keys.htmlAWS managed CMKs are CMKs in your account that are created, managed, and used on your behalfby an AWS service that is integrated with AWS KMS. This CMK is unique to your AWS account andregion. Only the service that created the AWS managed CMK can use it You can login to you 1AMdashbaord . Click on ""Encryption Keys"" You will find the list based on the services you are using asfollows:* aws/elasticfilesystem 1 aws/lightsail* aws/s3* aws/rds and many more31Detailed Guide: KMSYou can recognize AWS managed CMKs because their aliases have the format aws/service-name,such as aws/redshift. Typically, a service creates its AWS managed CMK in your account when you setup the service or the first time you use the CMfC The AWS services that integrate with AWS KMS canuse it in many different ways. Some services create AWS managed CMKs in your account. Otherservices require that you specify a customer managed CMK that you have created. And, otherssupport both types of CMKs to allow you the ease of an AWS managed CMK or the control of acustomer-managed CMK Rotation period for CMKs is as follows:* AWS managed CMKs: 1095 days* Customer managed CMKs: 365 daysSince question mentions about ""CMK where backing keys is managed by AWS"", its Amazon(AWS)managed and its rotation period turns out to be 1095 days{every 3 years) For more details, pleasecheck below AWS Docs:https://docs.aws.amazon.com/kms/latest/developerguide/concepts.htmlThe correct answer is: After 3 yearsSubmit your Feedback/Queries to our Experts",
